Nature,Description
Positive,"Your explanation was incredibly accurate, leaving no room for misinterpretation."
Positive,The clarity of your description makes even complex concepts seem simple and understandable.
Positive,"The depth of your analysis is impressive, offering insights I hadn't considered before."
Positive,Your attention to detail ensures that every aspect of the topic is thoroughly covered.
Positive,The precision in your explanation showcases your deep understanding of the subject.
Positive,Your clear and concise description allows others to grasp the topic effortlessly.
Positive,"The thoroughness of your coverage is commendable, providing a comprehensive overview."
Positive,"Your description is spot on, highlighting the key points with remarkable accuracy."
Positive,The lucidity of your explanation makes the information accessible to everyone.
Positive,"The depth you go into is remarkable, showing a profound grasp of the subject matter."
Positive,Your ability to convey information so clearly is truly impressive.
Positive,The correctness of your description reassures me of the reliability of the information.
Positive,The clarity with which you presented the information reflects your expertise.
Positive,Your deep dive into the topic uncovered nuances that are often overlooked.
Positive,The exactness of your description leaves no doubt about the validity of your points.
Negative,Your explanation contains several inaccuracies that undermine the overall understanding of the topic.
Negative,The lack of clarity in your description makes it difficult to follow and understand.
Negative,"Your analysis is superficial, failing to explore the topic in sufficient depth."
Negative,"The information you provided is incorrect, leading to potential misunderstandings."
Negative,"Your explanation is vague and unclear, leaving too much to the reader's interpretation."
Negative,The lack of depth in your description doesn't do justice to the complexity of the subject.
Negative,"Your description is riddled with errors, which detract from its credibility."
Negative,The ambiguity in your explanation makes it hard to grasp the main points.
Negative,Your analysis is too shallow to offer any meaningful insights.
Negative,The incorrect details in your description need to be corrected for it to be reliable.
Negative,Your unclear explanation makes it challenging to comprehend the information.
Negative,The surface-level treatment of the topic fails to address its nuances.
Negative,Your explanation contains factual errors that need to be addressed.
Negative,The lack of clarity in your description results in confusion rather than understanding.
Negative,Your analysis lacks the necessary depth to provide a comprehensive understanding of the subject.
