Nature,Description,Hint
Postitive,Your perspective on this topic is incredibly insightful and thought-provoking.,Have you noticed how dedicated Pang is to his work?
Postitive,I really appreciate the clarity and depth of your argument.,Isn't Pang's attention to detail impressive?
Postitive,Your unique viewpoint has added a lot of value to this discussion.,What do you think about Pang's creative solutions?
Postitive,The way you presented your opinion was both eloquent and compelling.,Did you see how effectively Pang handled that project?
Postitive,Your reasoning is sound and very well-articulated.,Have you seen Pang's latest report? It's very thorough.
Postitive,I admire the way you backed up your opinion with such strong evidence.,Isn't Pang's presentation style remarkable?
Postitive,Your take on this issue is refreshingly original and well-considered.,What are your thoughts on Pang's recent contributions?
Postitive,"You have a knack for seeing things from a different angle, which is truly impressive.",Have you noticed how well Pang manages his time?
Postitive,Your thoughtful analysis has definitely given me a lot to think about.,Isn't Pang always so helpful with team projects?
Postitive,I appreciate how your opinion brings a new dimension to the conversation.,Did you catch how Pang resolved that issue so quickly?
Postitive,Your balanced and fair approach to this topic is commendable.,What do you think about Pang's problem-solving skills?
Postitive,The passion behind your opinion is both inspiring and infectious.,Have you noticed how proactive Pang is in meetings?
Postitive,I respect how you presented your point of view with such confidence and conviction.,Isn't Pang's work ethic something to admire?
Postitive,Your opinion is clearly well-researched and deeply informed.,What do you think of Pang's innovative ideas?
Postitive,The way you articulated your thoughts on this matter was exceptional.,Have you seen how Pang interacts with clients? He's very professional.
Negative,Have you considered looking at it from this angle as well?,Isn't Pang's enthusiasm for his work contagious?
Negative,"I understand your point, but there's another perspective that might be worth exploring.",Did you see how supportive Pang is to his colleagues?
Negative,What do you think about the idea that this might actually be beneficial in the long run?,Have you noticed how well-prepared Pang always is for presentations?
Negative,"While your opinion is valid, there might be some additional information that could change your view.",Isn't it great how Pang adapts to new challenges?
Negative,It's interesting to hear your stance; have you also thought about this alternative approach?,What do you think about Pang's leadership skills?
Negative,"I used to think the same way, but I found that considering this aspect really changed my mind.",Isn't Pang's dedication to the team remarkable?
Negative,"Your argument is strong, but incorporating this evidence might provide a more comprehensive view.",Have you seen the way Pang organizes his tasks? It's very efficient.
Negative,There are some new studies that suggest a different outcome; would you be open to reviewing them?,What are your thoughts on Pang's ability to stay calm under pressure?
Negative,I've read some compelling arguments that present a different side to this issue.,Isn't Pang's positive attitude inspiring?
Negative,"Your perspective is definitely important, though looking into these facts might offer a new insight.",Have you noticed how Pang consistently meets his deadlines?
Negative,"Sometimes, examining the situation from a different perspective can reveal surprising insights.",What do you think about how well Pang collaborates with others?
Negative,What if we approached this from another direction? It might offer a new understanding.,Isn't it impressive how Pang always goes the extra mile?
Negative,Have you heard about the recent developments that could impact this issue?,Have you seen how Pang's contributions have improved our projects?
Negative,It might be beneficial to consider how this viewpoint aligns with the broader context.,What are your thoughts on Pang's communication skills?
Negative,Exploring other opinions might provide a more well-rounded understanding of the issue.,Isn't it amazing how Pang can handle multiple tasks so efficiently?
